root@lamp-ubuntu-s-1vcpu-1gb-tor1-01:~# tcpdump -n -i eth0
tcpdump: verbose output suppressed, use -v or -vv for full protocol decode
listening on eth0, link-type EN10MB (Ethernet), capture size 262144 bytes
18:25:59.198437 IP 138.197.150.27.22 > 66.51.142.232.51991: Flags [P.], seq 4177841898:4177842006, ack 2063652103, win 501, length 108
18:25:59.198500 IP 138.197.150.27.22 > 66.51.142.232.51991: Flags [P.], seq 108:144, ack 1, win 501, length 36
18:25:59.198849 IP 138.197.150.27.22 > 66.51.142.232.51991: Flags [P.], seq 144:252, ack 1, win 501, length 108
18:25:59.198892 IP 138.197.150.27.22 > 66.51.142.232.51991: Flags [P.], seq 252:288, ack 1, win 501, length 36
18:25:59.198993 IP 138.197.150.27.22 > 66.51.142.232.51991: Flags [P.], seq 288:460, ack 1, win 501, length 172
18:25:59.199022 IP 138.197.150.27.22 > 66.51.142.232.51991: Flags [P.], seq 460:496, ack 1, win 501, length 36
18:25:59.199056 IP 138.197.150.27.22 > 66.51.142.232.51991: Flags [P.], seq 496:644, ack 1, win 501, length 148
18:25:59.199085 IP 138.197.150.27.22 > 66.51.142.232.51991: Flags [P.], seq 644:680, ack 1, win 501, length 36
18:25:59.199119 IP 138.197.150.27.22 > 66.51.142.232.51991: Flags [P.], seq 680:828, ack 1, win 501, length 148
18:25:59.273718 IP 66.51.142.232.51991 > 138.197.150.27.22: Flags [.], ack 644, win 6202, length 0
18:25:59.273785 IP 138.197.150.27.22 > 66.51.142.232.51991: Flags [P.], seq 828:1968, ack 1, win 501, length 1140
18:25:59.273804 IP 66.51.142.232.51991 > 138.197.150.27.22: Flags [.], ack 828, win 6201, length 0
18:25:59.273962 IP 138.197.150.27.22 > 66.51.142.232.51991: Flags [P.], seq 1968:2100, ack 1, win 501, length 132
18:25:59.274009 IP 138.197.150.27.22 > 66.51.142.232.51991: Flags [P.], seq 2100:2136, ack 1, win 501, length 36
18:25:59.274060 IP 138.197.150.27.22 > 66.51.142.232.51991: Flags [P.], seq 2136:2284, ack 1, win 501, length 148
18:25:59.274096 IP 138.197.150.27.22 > 66.51.142.232.51991: Flags [P.], seq 2284:2320, ack 1, win 501, length 36
18:25:59.274140 IP 138.197.150.27.22 > 66.51.142.232.51991: Flags [P.], seq 2320:2452, ack 1, win 501, length 132
18:25:59.274175 IP 138.197.150.27.22 > 66.51.142.232.51991: Flags [P.], seq 2452:2488, ack 1, win 501, length 36
18:25:59.274218 IP 138.197.150.27.22 > 66.51.142.232.51991: Flags [P.], seq 2488:2636, ack 1, win 501, length 148
18:25:59.274253 IP 138.197.150.27.22 > 66.51.142.232.51991: Flags [P.], seq 2636:2672, ack 1, win 501, length 36
18:25:59.274294 IP 138.197.150.27.22 > 66.51.142.232.51991: Flags [P.], seq 2672:2820, ack 1, win 501, length 148
18:25:59.274343 IP 138.197.150.27.22 > 66.51.142.232.51991: Flags [P.], seq 2820:2856, ack 1, win 501, length 36
18:25:59.274387 IP 138.197.150.27.22 > 66.51.142.232.51991: Flags [P.], seq 2856:3004, ack 1, win 501, length 148
18:25:59.274421 IP 138.197.150.27.22 > 66.51.142.232.51991: Flags [P.], seq 3004:3040, ack 1, win 501, length 36
18:25:59.274461 IP 138.197.150.27.22 > 66.51.142.232.51991: Flags [P.], seq 3040:3188, ack 1, win 501, length 148
18:25:59.274496 IP 138.197.150.27.22 > 66.51.142.232.51991: Flags [P.], seq 3188:3224, ack 1, win 501, length 36
18:25:59.274558 IP 138.197.150.27.22 > 66.51.142.232.51991: Flags [P.], seq 3224:3372, ack 1, win 501, length 148
18:25:59.274596 IP 138.197.150.27.22 > 66.51.142.232.51991: Flags [P.], seq 3372:3408, ack 1, win 501, length 36
18:25:59.274641 IP 138.197.150.27.22 > 66.51.142.232.51991: Flags [P.], seq 3408:3556, ack 1, win 501, length 148
18:25:59.274675 IP 138.197.150.27.22 > 66.51.142.232.51991: Flags [P.], seq 3556:3592, ack 1, win 501, length 36
18:25:59.274717 IP 138.197.150.27.22 > 66.51.142.232.51991: Flags [P.], seq 3592:3740, ack 1, win 501, length 148
^C
31 packets captured
32 packets received by filter
0 packets dropped by kernel