root@lamp-ubuntu-s-1vcpu-1gb-tor1-01:~# tcpdump -r 0001.pcap
reading from file 0001.pcap, link-type EN10MB (Ethernet)
18:21:53.915433 IP 138.197.150.27.ssh > 66.51.142.232.tpia.ylw.cipherkey.com.51991: Flags [P.], seq 4174303042:4174303078, ack 2063648359, win 501, length 36
18:21:53.915861 IP 138.197.150.27.ssh > 66.51.142.232.tpia.ylw.cipherkey.com.51991: Flags [P.], seq 36:80, ack 1, win 501, length 44
18:21:53.915912 IP 138.197.150.27.ssh > 66.51.142.232.tpia.ylw.cipherkey.com.51991: Flags [P.], seq 80:188, ack 1, win 501, length 108
18:21:53.916012 IP 138.197.150.27.ssh > 66.51.142.232.tpia.ylw.cipherkey.com.51991: Flags [P.], seq 188:224, ack 1, win 501, length 36
18:21:53.992374 IP 66.51.142.232.tpia.ylw.cipherkey.com.51991 > 138.197.150.27.ssh: Flags [.], ack 36, win 6200, options [nop,nop,sack 1 {188:224}], length 0
18:21:53.992417 IP 66.51.142.232.tpia.ylw.cipherkey.com.51991 > 138.197.150.27.ssh: Flags [.], ack 80, win 6200, options [nop,nop,sack 1 {188:224}], length 0
18:21:53.992423 IP 66.51.142.232.tpia.ylw.cipherkey.com.51991 > 138.197.150.27.ssh: Flags [.], ack 224, win 6199, length 0
18:21:54.797721 IP 45.155.205.160.57389 > 138.197.150.27.52162: Flags [S], seq 2455890359, win 1024, length 0
18:21:58.457151 IP 185.156.73.91.58255 > 138.197.150.27.33533: Flags [S], seq 1026635194, win 1024, length 0
18:21:58.590682 IP 104.236.228.230.41238 > 138.197.150.27.ssh: Flags [S], seq 1727246100, win 29200, options [mss 1460,sackOK,TS val 3698577406 ecr 0,nop,wscale 7], length 0
18:21:58.590730 IP 138.197.150.27 > 104.236.228.230: ICMP 138.197.150.27 tcp port ssh unreachable, length 68
18:21:58.604560 IP 45.155.205.129.57201 > 138.197.150.27.6553: Flags [S], seq 1337468267, win 1024, length 0
18:22:04.109471 IP 45.155.205.130.57219 > 138.197.150.27.13020: Flags [S], seq 3158752605, win 1024, length 0
18:22:07.217035 IP 139.155.86.214.34110 > 138.197.150.27.ssh: Flags [FP.], seq 1409997185:1409997237, ack 517341573, win 262, options [nop,nop,TS val 995163776 ecr 3760160557], length 52
18:22:07.217093 IP 138.197.150.27 > 139.155.86.214: ICMP 138.197.150.27 tcp port ssh unreachable, length 112
18:22:12.718588 IP 138.197.150.27.ssh > 139.155.86.214.34110: Flags [P.], seq 4294967229:1, ack 0, win 507, options [nop,nop,TS val 3760182573 ecr 995123913], length 68
18:22:12.983880 IP 139.155.86.214.34110 > 138.197.150.27.ssh: Flags [.], ack 1, win 262, options [nop,nop,TS val 995169543 ecr 3760182573,nop,nop,sack 1 {4294967229:1}], length 0
18:22:12.983936 IP 138.197.150.27 > 139.155.86.214: ICMP 138.197.150.27 tcp port ssh unreachable, length 72
18:22:16.790025 IP 139.196.94.85.56713 > 138.197.150.27.1894: Flags [S], seq 1718471975, win 1024, length 0
18:22:17.192757 IP 218.92.0.184.36491 > 138.197.150.27.ssh: Flags [S], seq 3500301476, win 14600, options [mss 1460,sackOK,TS val 2416854026 ecr 0,nop,wscale 7], length 0
18:22:17.192818 IP 138.197.150.27.ssh > 218.92.0.184.36491: Flags [S.], seq 2521561490, ack 3500301477, win 65160, options [mss 1460,sackOK,TS val 443867087 ecr 2416854026,nop,wscale 7], length 0
18:22:17.415993 IP 218.92.0.184.36491 > 138.197.150.27.ssh: Flags [.], ack 1, win 115, options [nop,nop,TS val 2416854250 ecr 443867087], length 0
18:22:17.416060 IP 218.92.0.184.36491 > 138.197.150.27.ssh: Flags [P.], seq 1:16, ack 1, win 115, options [nop,nop,TS val 2416854250 ecr 443867087], length 15
18:22:17.426068 IP 138.197.150.27.ssh > 218.92.0.184.36491: Flags [P.], seq 1:42, ack 1, win 510, options [nop,nop,TS val 443867320 ecr 2416854250], length 41
18:22:17.649057 IP 218.92.0.184.36491 > 138.197.150.27.ssh: Flags [.], ack 42, win 115, options [nop,nop,TS val 2416854483 ecr 443867320], length 0
18:22:17.649188 IP 218.92.0.184.36491 > 138.197.150.27.ssh: Flags [P.], seq 16:688, ack 42, win 115, options [nop,nop,TS val 2416854483 ecr 443867320], length 672
18:22:18.088110 IP 218.92.0.184.36491 > 138.197.150.27.ssh: Flags [P.], seq 1:16, ack 42, win 115, options [nop,nop,TS val 2416854922 ecr 443867320], length 15
18:22:18.088148 IP 138.197.150.27.ssh > 218.92.0.184.36491: Flags [.], ack 16, win 510, options [nop,nop,TS val 443867982 ecr 2416854922], length 0
18:22:18.089583 IP 138.197.150.27.ssh > 218.92.0.184.36491: Flags [P.], seq 42:1098, ack 16, win 510, options [nop,nop,TS val 443867983 ecr 2416854922], length 1056
18:22:18.766576 IP 138.197.150.27.ssh > 218.92.0.184.36491: Flags [P.], seq 42:1098, ack 16, win 510, options [nop,nop,TS val 443868660 ecr 2416854922], length 1056
18:22:19.470586 IP 138.197.150.27.ssh > 218.92.0.184.36491: Flags [P.], seq 42:1098, ack 16, win 510, options [nop,nop,TS val 443869364 ecr 2416854922], length 1056
18:22:20.702031 IP 106.12.152.28.54182 > 138.197.150.27.ssh: Flags [S], seq 215390444, win 64240, options [mss 1460,sackOK,TS val 1435486551 ecr 0,nop,wscale 7], length 0
18:22:20.702097 IP 138.197.150.27.ssh > 106.12.152.28.54182: Flags [S.], seq 504523930, ack 215390445, win 65160, options [mss 1460,sackOK,TS val 4057987952 ecr 1435486551,nop,wscale 7], length 0
18:22:20.846555 IP 138.197.150.27.ssh > 218.92.0.184.36491: Flags [P.], seq 42:1098, ack 16, win 510, options [nop,nop,TS val 443870740 ecr 2416854922], length 1056
18:22:20.964420 IP 106.12.152.28.54182 > 138.197.150.27.ssh: Flags [.], ack 1, win 502, options [nop,nop,TS val 1435486814 ecr 4057987952], length 0
18:22:20.973872 IP 138.197.150.27.ssh > 106.12.152.28.54182: Flags [P.], seq 1:42, ack 1, win 510, options [nop,nop,TS val 4057988224 ecr 1435486814], length 41
18:22:21.235829 IP 106.12.152.28.54182 > 138.197.150.27.ssh: Flags [.], ack 42, win 502, options [nop,nop,TS val 1435487086 ecr 4057988224], length 0
18:22:21.235867 IP 106.12.152.28.54182 > 138.197.150.27.ssh: Flags [P.], seq 1:22, ack 42, win 502, options [nop,nop,TS val 1435487086 ecr 4057988224], length 21
18:22:21.235883 IP 138.197.150.27.ssh > 106.12.152.28.54182: Flags [.], ack 22, win 510, options [nop,nop,TS val 4057988486 ecr 1435487086], length 0
18:22:21.237451 IP 138.197.150.27.ssh > 106.12.152.28.54182: Flags [P.], seq 42:1098, ack 22, win 510, options [nop,nop,TS val 4057988487 ecr 1435487086], length 1056
18:22:21.500153 IP 106.12.152.28.54182 > 138.197.150.27.ssh: Flags [P.], seq 22:462, ack 1098, win 501, options [nop,nop,TS val 1435487350 ecr 4057988487], length 440
18:22:21.500206 IP 138.197.150.27.ssh > 106.12.152.28.54182: Flags [.], ack 462, win 507, options [nop,nop,TS val 4057988750 ecr 1435487350], length 0
18:22:21.763023 IP 106.12.152.28.54182 > 138.197.150.27.ssh: Flags [P.], seq 462:510, ack 1098, win 501, options [nop,nop,TS val 1435487613 ecr 4057988750], length 48
18:22:21.763064 IP 138.197.150.27.ssh > 106.12.152.28.54182: Flags [.], ack 510, win 507, options [nop,nop,TS val 4057989013 ecr 1435487613], length 0
18:22:21.767975 IP 138.197.150.27.ssh > 106.12.152.28.54182: Flags [P.], seq 1098:1378, ack 510, win 507, options [nop,nop,TS val 4057989018 ecr 1435487613], length 280
18:22:21.955161 IP 91.243.45.39.61319 > 138.197.150.27.11109: Flags [S], seq 547045791, win 1024, length 0
18:22:22.510607 IP 138.197.150.27.ssh > 106.12.152.28.54182: Flags [P.], seq 1098:1378, ack 510, win 507, options [nop,nop,TS val 4057989760 ecr 1435487613], length 280
18:22:22.656665 IP 45.155.205.157.57295 > 138.197.150.27.32952: Flags [S], seq 1092459591, win 1024, length 0
18:22:22.729127 IP 1.119.131.102.43272 > 138.197.150.27.ssh: Flags [S], seq 596158660, win 14600, options [mss 1460,sackOK,TS val 3209917751 ecr 0,nop,wscale 7], length 0
18:22:22.729183 IP 138.197.150.27 > 1.119.131.102: ICMP 138.197.150.27 tcp port ssh unreachable, length 68
18:22:22.774622 IP 106.12.152.28.54182 > 138.197.150.27.ssh: Flags [P.], seq 510:526, ack 1378, win 501, options [nop,nop,TS val 1435488624 ecr 4057989760], length 16
18:22:22.774670 IP 138.197.150.27.ssh > 106.12.152.28.54182: Flags [.], ack 526, win 507, options [nop,nop,TS val 4057990024 ecr 1435488624], length 0
18:22:23.036479 IP 106.12.152.28.54182 > 138.197.150.27.ssh: Flags [P.], seq 526:578, ack 1378, win 501, options [nop,nop,TS val 1435488886 ecr 4057990024], length 52
18:22:23.036518 IP 138.197.150.27.ssh > 106.12.152.28.54182: Flags [.], ack 578, win 507, options [nop,nop,TS val 4057990286 ecr 1435488886], length 0
18:22:23.036631 IP 138.197.150.27.ssh > 106.12.152.28.54182: Flags [P.], seq 1378:1430, ack 578, win 507, options [nop,nop,TS val 4057990286 ecr 1435488886], length 52
18:22:23.726580 IP 138.197.150.27.ssh > 218.92.0.184.36491: Flags [P.], seq 42:1098, ack 16, win 510, options [nop,nop,TS val 443873620 ecr 2416854922], length 1056
18:22:23.734583 IP 138.197.150.27.ssh > 106.12.152.28.54182: Flags [P.], seq 1378:1430, ack 578, win 507, options [nop,nop,TS val 4057990984 ecr 1435488886], length 52
18:22:25.102576 IP 138.197.150.27.ssh > 106.12.152.28.54182: Flags [P.], seq 1378:1430, ack 578, win 507, options [nop,nop,TS val 4057992352 ecr 1435488886], length 52
18:22:25.365214 IP 106.12.152.28.54182 > 138.197.150.27.ssh: Flags [P.], seq 578:662, ack 1430, win 501, options [nop,nop,TS val 1435491215 ecr 4057992352], length 84
18:22:25.406554 IP 138.197.150.27.ssh > 106.12.152.28.54182: Flags [.], ack 662, win 507, options [nop,nop,TS val 4057992656 ecr 1435491215], length 0
18:22:27.731044 IP 123.207.11.65.33786 > 138.197.150.27.ssh: Flags [S], seq 2775130944, win 29200, options [mss 1424,sackOK,TS val 306172045 ecr 0,nop,wscale 7], length 0
18:22:27.731103 IP 138.197.150.27.ssh > 123.207.11.65.33786: Flags [S.], seq 2369551636, ack 2775130945, win 65160, options [mss 1460,sackOK,TS val 3941343292 ecr 306172045,nop,wscale 7], length 0
18:22:27.962153 IP 123.207.11.65.33786 > 138.197.150.27.ssh: Flags [.], ack 1, win 229, options [nop,nop,TS val 306172102 ecr 3941343292], length 0
18:22:27.971423 IP 138.197.150.27.ssh > 123.207.11.65.33786: Flags [P.], seq 1:42, ack 1, win 510, options [nop,nop,TS val 3941343532 ecr 306172102], length 41
18:22:28.202065 IP 123.207.11.65.33786 > 138.197.150.27.ssh: Flags [.], ack 42, win 229, options [nop,nop,TS val 306172162 ecr 3941343532], length 0
18:22:28.202100 IP 123.207.11.65.33786 > 138.197.150.27.ssh: Flags [P.], seq 1:22, ack 42, win 229, options [nop,nop,TS val 306172162 ecr 3941343532], length 21
18:22:28.202118 IP 138.197.150.27.ssh > 123.207.11.65.33786: Flags [.], ack 22, win 510, options [nop,nop,TS val 3941343763 ecr 306172162], length 0
18:22:28.203880 IP 138.197.150.27.ssh > 123.207.11.65.33786: Flags [P.], seq 42:1098, ack 22, win 510, options [nop,nop,TS val 3941343765 ecr 306172162], length 1056
18:22:28.434684 IP 123.207.11.65.33786 > 138.197.150.27.ssh: Flags [P.], seq 22:462, ack 1098, win 245, options [nop,nop,TS val 306172221 ecr 3941343765], length 440
18:22:28.434739 IP 138.197.150.27.ssh > 123.207.11.65.33786: Flags [.], ack 462, win 507, options [nop,nop,TS val 3941343995 ecr 306172221], length 0
18:22:28.665262 IP 123.207.11.65.33786 > 138.197.150.27.ssh: Flags [P.], seq 462:510, ack 1098, win 245, options [nop,nop,TS val 306172278 ecr 3941343995], length 48
18:22:28.665304 IP 138.197.150.27.ssh > 123.207.11.65.33786: Flags [.], ack 510, win 507, options [nop,nop,TS val 3941344226 ecr 306172278], length 0
18:22:28.669964 IP 138.197.150.27.ssh > 123.207.11.65.33786: Flags [P.], seq 1098:1378, ack 510, win 507, options [nop,nop,TS val 3941344231 ecr 306172278], length 280
18:22:28.777716 IP 138.197.150.27.ssh > 106.12.152.28.54182: Flags [P.], seq 1430:1498, ack 662, win 507, options [nop,nop,TS val 4057996027 ecr 1435491215], length 68
18:22:28.903162 IP 123.207.11.65.33786 > 138.197.150.27.ssh: Flags [P.], seq 510:526, ack 1378, win 262, options [nop,nop,TS val 306172338 ecr 3941344231], length 16
18:22:28.903213 IP 138.197.150.27.ssh > 123.207.11.65.33786: Flags [.], ack 526, win 507, options [nop,nop,TS val 3941344464 ecr 306172338], length 0
18:22:29.039568 IP 106.12.152.28.54182 > 138.197.150.27.ssh: Flags [P.], seq 662:714, ack 1498, win 501, options [nop,nop,TS val 1435494889 ecr 4057996027], length 52
18:22:29.039616 IP 138.197.150.27.ssh > 106.12.152.28.54182: Flags [.], ack 714, win 507, options [nop,nop,TS val 4057996289 ecr 1435494889], length 0
18:22:29.039647 IP 106.12.152.28.54182 > 138.197.150.27.ssh: Flags [F.], seq 714, ack 1498, win 501, options [nop,nop,TS val 1435494889 ecr 4057996027], length 0
18:22:29.041967 IP 138.197.150.27.ssh > 106.12.152.28.54182: Flags [F.], seq 1498, ack 715, win 507, options [nop,nop,TS val 4057996292 ecr 1435494889], length 0
18:22:29.133762 IP 123.207.11.65.33786 > 138.197.150.27.ssh: Flags [P.], seq 526:578, ack 1378, win 262, options [nop,nop,TS val 306172395 ecr 3941344464], length 52
18:22:29.133799 IP 138.197.150.27.ssh > 123.207.11.65.33786: Flags [.], ack 578, win 507, options [nop,nop,TS val 3941344694 ecr 306172395], length 0
18:22:29.133906 IP 138.197.150.27.ssh > 123.207.11.65.33786: Flags [P.], seq 1378:1430, ack 578, win 507, options [nop,nop,TS val 3941344695 ecr 306172395], length 52
18:22:29.303780 IP 106.12.152.28.54182 > 138.197.150.27.ssh: Flags [.], ack 1499, win 501, options [nop,nop,TS val 1435495154 ecr 4057996292], length 0
18:22:29.358573 IP 138.197.150.27.ssh > 218.92.0.184.36491: Flags [P.], seq 42:1098, ack 16, win 510, options [nop,nop,TS val 443879252 ecr 2416854922], length 1056
18:22:29.366164 IP 123.207.11.65.33786 > 138.197.150.27.ssh: Flags [P.], seq 578:662, ack 1430, win 262, options [nop,nop,TS val 306172453 ecr 3941344695], length 84
18:22:29.406583 IP 138.197.150.27.ssh > 123.207.11.65.33786: Flags [.], ack 662, win 507, options [nop,nop,TS val 3941344967 ecr 306172453], length 0
18:22:29.508804 IP 37.49.230.238.51563 > 138.197.150.27.37810: UDP, length 63
18:22:30.114563 IP li1625-180.members.linode.com.43474 > 138.197.150.27.3388: Flags [S], seq 3560752036, win 1024, length 0
18:22:32.778695 IP 138.197.150.27.ssh > 123.207.11.65.33786: Flags [P.], seq 1430:1498, ack 662, win 507, options [nop,nop,TS val 3941348339 ecr 306172453], length 68
18:22:33.009515 IP 123.207.11.65.33786 > 138.197.150.27.ssh: Flags [P.], seq 662:714, ack 1498, win 262, options [nop,nop,TS val 306173364 ecr 3941348339], length 52
18:22:33.009562 IP 138.197.150.27.ssh > 123.207.11.65.33786: Flags [.], ack 714, win 507, options [nop,nop,TS val 3941348570 ecr 306173364], length 0
18:22:33.009589 IP 123.207.11.65.33786 > 138.197.150.27.ssh: Flags [F.], seq 714, ack 1498, win 262, options [nop,nop,TS val 306173364 ecr 3941348339], length 0
18:22:33.012764 IP 138.197.150.27.ssh > 123.207.11.65.33786: Flags [F.], seq 1498, ack 715, win 507, options [nop,nop,TS val 3941348573 ecr 306173364], length 0
18:22:33.243275 IP 123.207.11.65.33786 > 138.197.150.27.ssh: Flags [.], ack 1499, win 262, options [nop,nop,TS val 306173423 ecr 3941348573], length 0
18:22:33.537590 IP 139.155.86.214.46306 > 138.197.150.27.ssh: Flags [S], seq 1256390151, win 29200, options [mss 1424,sackOK,TS val 995190091 ecr 0,nop,wscale 7], length 0
18:22:33.537641 IP 138.197.150.27 > 139.155.86.214: ICMP 138.197.150.27 tcp port ssh unreachable, length 68
18:22:34.742683 IP 195.54.161.150.42266 > 138.197.150.27.44066: Flags [S], seq 2461439055, win 1024, length 0
18:22:35.208867 IP 91.243.45.39.61319 > 138.197.150.27.10739: Flags [S], seq 3092358578, win 1024, length 0
18:22:40.240362 IP zg-1218a-23.stretchoid.com.53806 > 138.197.150.27.netbios-ssn: Flags [S], seq 3188310512, win 65535, length 0
18:22:40.366590 IP 138.197.150.27.ssh > 218.92.0.184.36491: Flags [P.], seq 42:1098, ack 16, win 510, options [nop,nop,TS val 443890260 ecr 2416854922], length 1056
18:22:41.167913 IP scanner-23.ch1.censys-scanner.com.8497 > 138.197.150.27.23476: Flags [S], seq 3171530523, win 1024, options [mss 1460], length 0
18:22:42.800928 IP 139.155.86.214.34110 > 138.197.150.27.ssh: Flags [FP.], seq 0:52, ack 1, win 262, options [nop,nop,TS val 995199360 ecr 3760182573], length 52
18:22:42.800976 IP 138.197.150.27 > 139.155.86.214: ICMP 138.197.150.27 tcp port ssh unreachable, length 112
18:22:46.369393 IP 42.192.190.123.52734 > 138.197.150.27.ssh: Flags [S], seq 883537113, win 64240, options [mss 1424,sackOK,TS val 3962719754 ecr 0,nop,wscale 7], length 0
18:22:46.369468 IP 138.197.150.27.ssh > 42.192.190.123.52734: Flags [S.], seq 3804261605, ack 883537114, win 65160, options [mss 1460,sackOK,TS val 675885311 ecr 3962719754,nop,wscale 7], length 0
18:22:46.608208 IP 42.192.190.123.52734 > 138.197.150.27.ssh: Flags [.], ack 1, win 502, options [nop,nop,TS val 3962719993 ecr 675885311], length 0
18:22:46.621001 IP 138.197.150.27.ssh > 42.192.190.123.52734: Flags [P.], seq 1:42, ack 1, win 510, options [nop,nop,TS val 675885563 ecr 3962719993], length 41
18:22:46.860446 IP 42.192.190.123.52734 > 138.197.150.27.ssh: Flags [.], ack 42, win 502, options [nop,nop,TS val 3962720246 ecr 675885563], length 0
18:22:46.860475 IP 42.192.190.123.52734 > 138.197.150.27.ssh: Flags [P.], seq 1:22, ack 42, win 502, options [nop,nop,TS val 3962720246 ecr 675885563], length 21
18:22:47.565122 IP 42.192.190.123.52734 > 138.197.150.27.ssh: Flags [P.], seq 1:22, ack 42, win 502, options [nop,nop,TS val 3962720950 ecr 675885563], length 21
18:22:47.565179 IP 138.197.150.27.ssh > 42.192.190.123.52734: Flags [.], ack 22, win 510, options [nop,nop,TS val 675886507 ecr 3962720950], length 0
18:22:47.566846 IP 138.197.150.27.ssh > 42.192.190.123.52734: Flags [P.], seq 42:1098, ack 22, win 510, options [nop,nop,TS val 675886509 ecr 3962720950], length 1056
18:22:47.804282 IP 42.192.190.123.52734 > 138.197.150.27.ssh: Flags [.], ack 1098, win 501, options [nop,nop,TS val 3962721190 ecr 675886509], length 0
18:22:47.804327 IP 42.192.190.123.52734 > 138.197.150.27.ssh: Flags [P.], seq 22:462, ack 1098, win 501, options [nop,nop,TS val 3962721190 ecr 675886509], length 440
18:22:48.379949 IP 124.251.110.148.41922 > 138.197.150.27.ssh: Flags [S], seq 3618682000, win 29200, options [mss 1460,sackOK,TS val 4004980048 ecr 0,nop,wscale 8], length 0
18:22:48.380006 IP 138.197.150.27.ssh > 124.251.110.148.41922: Flags [S.], seq 4267070864, ack 3618682001, win 65160, options [mss 1460,sackOK,TS val 3196744644 ecr 4004980048,nop,wscale 7], length 0
18:22:48.529221 IP 42.192.190.123.52734 > 138.197.150.27.ssh: Flags [P.], seq 22:462, ack 1098, win 501, options [nop,nop,TS val 3962721914 ecr 675886509], length 440
18:22:48.529281 IP 138.197.150.27.ssh > 42.192.190.123.52734: Flags [.], ack 462, win 507, options [nop,nop,TS val 675887471 ecr 3962721914], length 0
18:22:48.769167 IP 42.192.190.123.52734 > 138.197.150.27.ssh: Flags [P.], seq 462:510, ack 1098, win 501, options [nop,nop,TS val 3962722154 ecr 675887471], length 48
18:22:48.769202 IP 138.197.150.27.ssh > 42.192.190.123.52734: Flags [.], ack 510, win 507, options [nop,nop,TS val 675887711 ecr 3962722154], length 0
18:22:48.774174 IP 138.197.150.27.ssh > 42.192.190.123.52734: Flags [P.], seq 1098:1378, ack 510, win 507, options [nop,nop,TS val 675887716 ecr 3962722154], length 280
18:22:48.784663 IP 124.251.110.148.41922 > 138.197.150.27.ssh: Flags [.], ack 1, win 115, options [nop,nop,TS val 4004980139 ecr 3196744644], length 0
18:22:48.793604 IP 138.197.150.27.ssh > 124.251.110.148.41922: Flags [P.], seq 1:42, ack 1, win 510, options [nop,nop,TS val 3196745057 ecr 4004980139], length 41
18:22:49.013431 IP 42.192.190.123.52734 > 138.197.150.27.ssh: Flags [.], ack 1378, win 501, options [nop,nop,TS val 3962722399 ecr 675887716], length 0
18:22:49.016590 IP 42.192.190.123.52734 > 138.197.150.27.ssh: Flags [P.], seq 510:526, ack 1378, win 501, options [nop,nop,TS val 3962722402 ecr 675887716], length 16
18:22:49.016626 IP 138.197.150.27.ssh > 42.192.190.123.52734: Flags [.], ack 526, win 507, options [nop,nop,TS val 675887958 ecr 3962722402], length 0
18:22:49.224527 IP 124.251.110.148.41922 > 138.197.150.27.ssh: Flags [.], ack 42, win 115, options [nop,nop,TS val 4004980238 ecr 3196745057], length 0
18:22:49.253483 IP 42.192.190.123.52734 > 138.197.150.27.ssh: Flags [P.], seq 526:578, ack 1378, win 501, options [nop,nop,TS val 3962722639 ecr 675887958], length 52
18:22:49.253520 IP 138.197.150.27.ssh > 42.192.190.123.52734: Flags [.], ack 578, win 507, options [nop,nop,TS val 675888195 ecr 3962722639], length 0
18:22:49.253645 IP 138.197.150.27.ssh > 42.192.190.123.52734: Flags [P.], seq 1378:1430, ack 578, win 507, options [nop,nop,TS val 675888195 ecr 3962722639], length 52
18:22:49.255883 IP 124.251.110.148.41922 > 138.197.150.27.ssh: Flags [P.], seq 1:22, ack 42, win 115, options [nop,nop,TS val 4004980245 ecr 3196745057], length 21
18:22:49.255923 IP 138.197.150.27.ssh > 124.251.110.148.41922: Flags [.], ack 22, win 510, options [nop,nop,TS val 3196745520 ecr 4004980245], length 0
18:22:49.257373 IP 138.197.150.27.ssh > 124.251.110.148.41922: Flags [P.], seq 42:1098, ack 22, win 510, options [nop,nop,TS val 3196745521 ecr 4004980245], length 1056
18:22:49.493214 IP 42.192.190.123.52734 > 138.197.150.27.ssh: Flags [P.], seq 578:662, ack 1430, win 501, options [nop,nop,TS val 3962722878 ecr 675888195], length 84
18:22:49.534572 IP 138.197.150.27.ssh > 42.192.190.123.52734: Flags [.], ack 662, win 507, options [nop,nop,TS val 675888476 ecr 3962722878], length 0
18:22:49.741832 IP 124.251.110.148.41922 > 138.197.150.27.ssh: Flags [.], ack 1098, win 123, options [nop,nop,TS val 4004980355 ecr 3196745521], length 0
18:22:49.799579 IP 124.251.110.148.41922 > 138.197.150.27.ssh: Flags [P.], seq 22:462, ack 1098, win 123, options [nop,nop,TS val 4004980368 ecr 3196745521], length 440
18:22:49.799622 IP 138.197.150.27.ssh > 124.251.110.148.41922: Flags [.], ack 462, win 507, options [nop,nop,TS val 3196746063 ecr 4004980368], length 0
18:22:50.186263 IP 124.251.110.148.41922 > 138.197.150.27.ssh: Flags [P.], seq 462:510, ack 1098, win 123, options [nop,nop,TS val 4004980454 ecr 3196746063], length 48
18:22:50.186306 IP 138.197.150.27.ssh > 124.251.110.148.41922: Flags [.], ack 510, win 507, options [nop,nop,TS val 3196746450 ecr 4004980454], length 0
18:22:50.191101 IP 138.197.150.27.ssh > 124.251.110.148.41922: Flags [P.], seq 1098:1378, ack 510, win 507, options [nop,nop,TS val 3196746455 ecr 4004980454], length 280
18:22:50.471086 IP 221.181.185.135.54317 > 138.197.150.27.ssh: Flags [S], seq 1801228819, win 29200, options [mss 1460,sackOK,TS val 1128658 ecr 0,nop,wscale 7], length 0
18:22:50.471157 IP 138.197.150.27.ssh > 221.181.185.135.54317: Flags [S.], seq 3353739772, ack 1801228820, win 65160, options [mss 1460,sackOK,TS val 2019278801 ecr 1128658,nop,wscale 7], length 0
18:22:50.663929 IP 124.251.110.148.41922 > 138.197.150.27.ssh: Flags [.], ack 1378, win 131, options [nop,nop,TS val 4004980562 ecr 3196746455], length 0
18:22:50.670700 IP 124.251.110.148.41922 > 138.197.150.27.ssh: Flags [P.], seq 510:526, ack 1378, win 131, options [nop,nop,TS val 4004980563 ecr 3196746455], length 16
18:22:50.670738 IP 138.197.150.27.ssh > 124.251.110.148.41922: Flags [.], ack 526, win 507, options [nop,nop,TS val 3196746934 ecr 4004980563], length 0
18:22:50.772429 IP 221.181.185.135.54317 > 138.197.150.27.ssh: Flags [.], ack 1, win 229, options [nop,nop,TS val 1128733 ecr 2019278801], length 0
18:22:50.772496 IP 221.181.185.135.54317 > 138.197.150.27.ssh: Flags [P.], seq 1:16, ack 1, win 229, options [nop,nop,TS val 1128733 ecr 2019278801], length 15
18:22:50.786151 IP 138.197.150.27.ssh > 221.181.185.135.54317: Flags [P.], seq 1:42, ack 1, win 510, options [nop,nop,TS val 2019279116 ecr 1128733], length 41
18:22:51.087559 IP 221.181.185.135.54317 > 138.197.150.27.ssh: Flags [.], ack 42, win 229, options [nop,nop,TS val 1128812 ecr 2019279116], length 0
18:22:51.252747 IP 124.251.110.148.41922 > 138.197.150.27.ssh: Flags [P.], seq 526:578, ack 1378, win 131, options [nop,nop,TS val 4004980694 ecr 3196746934], length 52
18:22:51.252800 IP 138.197.150.27.ssh > 124.251.110.148.41922: Flags [.], ack 578, win 507, options [nop,nop,TS val 3196747516 ecr 4004980694], length 0
18:22:51.252898 IP 138.197.150.27.ssh > 124.251.110.148.41922: Flags [P.], seq 1378:1430, ack 578, win 507, options [nop,nop,TS val 3196747517 ecr 4004980694], length 52
18:22:51.678900 IP 221.181.185.135.54317 > 138.197.150.27.ssh: Flags [P.], seq 16:872, ack 42, win 229, options [nop,nop,TS val 1128960 ecr 2019279116], length 856
18:22:51.786013 IP 124.251.110.148.41922 > 138.197.150.27.ssh: Flags [P.], seq 578:662, ack 1430, win 131, options [nop,nop,TS val 4004980814 ecr 3196747517], length 84
18:22:51.826578 IP 138.197.150.27.ssh > 124.251.110.148.41922: Flags [.], ack 662, win 507, options [nop,nop,TS val 3196748090 ecr 4004980814], length 0
18:22:52.586814 IP 221.181.185.135.54317 > 138.197.150.27.ssh: Flags [P.], seq 1:872, ack 42, win 229, options [nop,nop,TS val 1129187 ecr 2019279116], length 871
18:22:52.586873 IP 138.197.150.27.ssh > 221.181.185.135.54317: Flags [.], ack 872, win 504, options [nop,nop,TS val 2019280917 ecr 1129187], length 0
18:22:52.588180 IP 138.197.150.27.ssh > 221.181.185.135.54317: Flags [P.], seq 42:1098, ack 872, win 504, options [nop,nop,TS val 2019280918 ecr 1129187], length 1056
18:22:52.889539 IP 221.181.185.135.54317 > 138.197.150.27.ssh: Flags [.], ack 1098, win 245, options [nop,nop,TS val 1129262 ecr 2019280918], length 0
18:22:52.889981 IP 221.181.185.135.54317 > 138.197.150.27.ssh: Flags [P.], seq 872:952, ack 1098, win 245, options [nop,nop,TS val 1129262 ecr 2019280918], length 80
18:22:52.889997 IP 138.197.150.27.ssh > 221.181.185.135.54317: Flags [.], ack 952, win 504, options [nop,nop,TS val 2019281220 ecr 1129262], length 0
18:22:52.890874 IP 138.197.150.27.ssh > 221.181.185.135.54317: Flags [P.], seq 1098:1410, ack 952, win 504, options [nop,nop,TS val 2019281221 ecr 1129262], length 312
18:22:52.905723 IP 138.197.150.27.ssh > 42.192.190.123.52734: Flags [P.], seq 1430:1498, ack 662, win 507, options [nop,nop,TS val 675891847 ecr 3962722878], length 68
18:22:53.145279 IP 42.192.190.123.52734 > 138.197.150.27.ssh: Flags [P.], seq 662:714, ack 1498, win 501, options [nop,nop,TS val 3962726531 ecr 675891847], length 52
18:22:53.145335 IP 138.197.150.27.ssh > 42.192.190.123.52734: Flags [.], ack 714, win 507, options [nop,nop,TS val 675892087 ecr 3962726531], length 0
18:22:53.145365 IP 42.192.190.123.52734 > 138.197.150.27.ssh: Flags [F.], seq 714, ack 1498, win 501, options [nop,nop,TS val 3962726531 ecr 675891847], length 0
18:22:53.151984 IP 138.197.150.27.ssh > 42.192.190.123.52734: Flags [F.], seq 1498, ack 715, win 507, options [nop,nop,TS val 675892094 ecr 3962726531], length 0
18:22:53.192920 IP 221.181.185.135.54317 > 138.197.150.27.ssh: Flags [P.], seq 952:968, ack 1410, win 262, options [nop,nop,TS val 1129338 ecr 2019281221], length 16
18:22:53.192969 IP 138.197.150.27.ssh > 221.181.185.135.54317: Flags [.], ack 968, win 504, options [nop,nop,TS val 2019281523 ecr 1129338], length 0
18:22:53.388158 IP 42.192.190.123.52734 > 138.197.150.27.ssh: Flags [.], ack 1499, win 501, options [nop,nop,TS val 3962726774 ecr 675892094], length 0
18:22:53.492416 IP 138.197.150.27.ssh > 124.251.110.148.41922: Flags [P.], seq 1430:1498, ack 662, win 507, options [nop,nop,TS val 3196749756 ecr 4004980814], length 68
18:22:53.494410 IP 221.181.185.135.54317 > 138.197.150.27.ssh: Flags [P.], seq 968:1032, ack 1410, win 262, options [nop,nop,TS val 1129413 ecr 2019281523], length 64
18:22:53.494451 IP 138.197.150.27.ssh > 221.181.185.135.54317: Flags [.], ack 1032, win 504, options [nop,nop,TS val 2019281824 ecr 1129413], length 0
18:22:53.494582 IP 138.197.150.27.ssh > 221.181.185.135.54317: Flags [P.], seq 1410:1474, ack 1032, win 504, options [nop,nop,TS val 2019281824 ecr 1129413], length 64
18:22:53.678592 IP 138.197.150.27.ssh > 139.155.86.214.34110: Flags [P.], seq 4294967229:1, ack 0, win 507, options [nop,nop,TS val 3760223533 ecr 995123913], length 68
18:22:53.782211 IP 124.251.110.148.41922 > 138.197.150.27.ssh: Flags [P.], seq 662:714, ack 1498, win 131, options [nop,nop,TS val 4004981263 ecr 3196749756], length 52
18:22:53.782268 IP 138.197.150.27.ssh > 124.251.110.148.41922: Flags [.], ack 714, win 507, options [nop,nop,TS val 3196750046 ecr 4004981263], length 0
18:22:53.782295 IP 124.251.110.148.41922 > 138.197.150.27.ssh: Flags [F.], seq 714, ack 1498, win 131, options [nop,nop,TS val 4004981263 ecr 3196749756], length 0
18:22:53.783559 IP 138.197.150.27.ssh > 124.251.110.148.41922: Flags [F.], seq 1498, ack 715, win 507, options [nop,nop,TS val 3196750047 ecr 4004981263], length 0
18:22:53.795940 IP 221.181.185.135.54317 > 138.197.150.27.ssh: Flags [P.], seq 1032:1112, ack 1474, win 262, options [nop,nop,TS val 1129489 ecr 2019281824], length 80
18:22:53.802862 IP 138.197.150.27.ssh > 221.181.185.135.54317: Flags [P.], seq 1474:1554, ack 1112, win 504, options [nop,nop,TS val 2019282133 ecr 1129489], length 80
18:22:54.104343 IP 221.181.185.135.54317 > 138.197.150.27.ssh: Flags [P.], seq 1112:1208, ack 1554, win 262, options [nop,nop,TS val 1129566 ecr 2019282133], length 96
18:22:54.146570 IP 138.197.150.27.ssh > 221.181.185.135.54317: Flags [.], ack 1208, win 504, options [nop,nop,TS val 2019282476 ecr 1129566], length 0
18:22:54.254369 IP 124.251.110.148.41922 > 138.197.150.27.ssh: Flags [.], ack 1499, win 131, options [nop,nop,TS val 4004981369 ecr 3196750047], length 0
18:22:57.516884 IP 138.197.150.27.ssh > 221.181.185.135.54317: Flags [P.], seq 1554:1634, ack 1208, win 504, options [nop,nop,TS val 2019285847 ecr 1129566], length 80
18:22:57.818318 IP 221.181.185.135.54317 > 138.197.150.27.ssh: Flags [P.], seq 1208:1304, ack 1634, win 262, options [nop,nop,TS val 1130494 ecr 2019285847], length 96
18:22:57.818358 IP 138.197.150.27.ssh > 221.181.185.135.54317: Flags [.], ack 1304, win 504, options [nop,nop,TS val 2019286148 ecr 1130494], length 0
18:22:59.602648 IP 178.128.1.67.43398 > 138.197.150.27.82: Flags [S], seq 3704606652, win 1024, length 0
18:22:59.817031 IP 45.155.205.156.57271 > 138.197.150.27.26067: Flags [S], seq 20440144, win 1024, length 0
18:23:01.230842 IP 138.197.150.27.ssh > 221.181.185.135.54317: Flags [P.], seq 1634:1714, ack 1304, win 504, options [nop,nop,TS val 2019289561 ecr 1130494], length 80
18:23:01.532095 IP 221.181.185.135.54317 > 138.197.150.27.ssh: Flags [P.], seq 1304:1400, ack 1714, win 262, options [nop,nop,TS val 1131423 ecr 2019289561], length 96
18:23:01.532139 IP 138.197.150.27.ssh > 221.181.185.135.54317: Flags [.], ack 1400, win 504, options [nop,nop,TS val 2019289862 ecr 1131423], length 0
18:23:02.767105 IP 194.147.140.28.50953 > 138.197.150.27.2840: Flags [S], seq 3470314063, win 1024, length 0
18:23:03.358752 IP 45.155.205.76.49240 > 138.197.150.27.58832: Flags [S], seq 670176002, win 1024, length 0
18:23:03.918589 IP 138.197.150.27.ssh > 218.92.0.184.36491: Flags [P.], seq 42:1098, ack 16, win 510, options [nop,nop,TS val 443913812 ecr 2416854922], length 1056
18:23:04.112930 IP 101.32.183.189.58556 > 138.197.150.27.ssh: Flags [S], seq 2536745088, win 29200, options [mss 1424,nop,nop,sackOK,nop,wscale 7], length 0
18:23:04.112995 IP 138.197.150.27.ssh > 101.32.183.189.58556: Flags [S.], seq 1231063513, ack 2536745089, win 64240, options [mss 1460,nop,nop,sackOK,nop,wscale 7], length 0
18:23:04.313656 IP 101.32.183.189.58556 > 138.197.150.27.ssh: Flags [.], ack 1, win 229, length 0
18:23:04.324281 IP 138.197.150.27.ssh > 101.32.183.189.58556: Flags [P.], seq 1:42, ack 1, win 502, length 41
18:23:04.524967 IP 101.32.183.189.58556 > 138.197.150.27.ssh: Flags [.], ack 42, win 229, length 0
18:23:04.525004 IP 101.32.183.189.58556 > 138.197.150.27.ssh: Flags [P.], seq 1:22, ack 42, win 229, length 21
18:23:04.525021 IP 138.197.150.27.ssh > 101.32.183.189.58556: Flags [.], ack 22, win 502, length 0
18:23:04.526880 IP 138.197.150.27.ssh > 101.32.183.189.58556: Flags [P.], seq 42:1098, ack 22, win 502, length 1056
18:23:04.731123 IP 101.32.183.189.58556 > 138.197.150.27.ssh: Flags [P.], seq 22:462, ack 1098, win 245, length 440
18:23:04.731204 IP 138.197.150.27.ssh > 101.32.183.189.58556: Flags [.], ack 462, win 501, length 0
18:23:04.931315 IP 101.32.183.189.58556 > 138.197.150.27.ssh: Flags [P.], seq 462:510, ack 1098, win 245, length 48
18:23:04.931352 IP 138.197.150.27.ssh > 101.32.183.189.58556: Flags [.], ack 510, win 501, length 0
18:23:04.936345 IP 138.197.150.27.ssh > 101.32.183.189.58556: Flags [P.], seq 1098:1378, ack 510, win 501, length 280
18:23:04.944668 IP 138.197.150.27.ssh > 221.181.185.135.54317: Flags [P.], seq 1714:1794, ack 1400, win 504, options [nop,nop,TS val 2019293274 ecr 1131423], length 80
18:23:05.140343 IP 101.32.183.189.58556 > 138.197.150.27.ssh: Flags [P.], seq 510:526, ack 1378, win 262, length 16
18:23:05.140408 IP 138.197.150.27.ssh > 101.32.183.189.58556: Flags [.], ack 526, win 501, length 0
18:23:05.246025 IP 221.181.185.135.54317 > 138.197.150.27.ssh: Flags [F.], seq 1464, ack 1794, win 262, options [nop,nop,TS val 1132351 ecr 2019293274], length 0
18:23:05.246078 IP 138.197.150.27.ssh > 221.181.185.135.54317: Flags [.], ack 1400, win 504, options [nop,nop,TS val 2019293576 ecr 1131423,nop,nop,sack 1 {1464:1465}], length 0
18:23:05.246095 IP 221.181.185.135.54317 > 138.197.150.27.ssh: Flags [P.], seq 1400:1464, ack 1794, win 262, options [nop,nop,TS val 1132351 ecr 2019293274], length 64
18:23:05.246127 IP 138.197.150.27.ssh > 221.181.185.135.54317: Flags [.], ack 1465, win 504, options [nop,nop,TS val 2019293576 ecr 1132351], length 0
18:23:05.246570 IP 221.181.185.135.45155 > 138.197.150.27.ssh: Flags [S], seq 1672171569, win 29200, options [mss 1460,sackOK,TS val 1132351 ecr 0,nop,wscale 7], length 0
18:23:05.246612 IP 138.197.150.27.ssh > 221.181.185.135.45155: Flags [S.], seq 3093359212, ack 1672171570, win 65160, options [mss 1460,sackOK,TS val 2019293576 ecr 1132351,nop,wscale 7], length 0
18:23:05.252347 IP 138.197.150.27.ssh > 221.181.185.135.54317: Flags [F.], seq 1794, ack 1465, win 504, options [nop,nop,TS val 2019293582 ecr 1132351], length 0
18:23:05.340451 IP 101.32.183.189.58556 > 138.197.150.27.ssh: Flags [P.], seq 526:578, ack 1378, win 262, length 52
18:23:05.340489 IP 138.197.150.27.ssh > 101.32.183.189.58556: Flags [.], ack 578, win 501, length 0
18:23:05.340641 IP 138.197.150.27.ssh > 101.32.183.189.58556: Flags [P.], seq 1378:1430, ack 578, win 501, length 52
18:23:05.540721 IP 101.32.183.189.58556 > 138.197.150.27.ssh: Flags [P.], seq 578:662, ack 1430, win 262, length 84
18:23:05.548037 IP 221.181.185.135.45155 > 138.197.150.27.ssh: Flags [.], ack 1, win 229, options [nop,nop,TS val 1132427 ecr 2019293576], length 0
18:23:05.548120 IP 221.181.185.135.45155 > 138.197.150.27.ssh: Flags [P.], seq 1:16, ack 1, win 229, options [nop,nop,TS val 1132427 ecr 2019293576], length 15
18:23:05.553638 IP 221.181.185.135.54317 > 138.197.150.27.ssh: Flags [.], ack 1795, win 262, options [nop,nop,TS val 1132428 ecr 2019293582], length 0
18:23:05.561158 IP 138.197.150.27.ssh > 221.181.185.135.45155: Flags [P.], seq 1:42, ack 1, win 510, options [nop,nop,TS val 2019293891 ecr 1132427], length 41
18:23:05.582603 IP 138.197.150.27.ssh > 101.32.183.189.58556: Flags [.], ack 662, win 501, length 0
18:23:05.862484 IP 221.181.185.135.45155 > 138.197.150.27.ssh: Flags [.], ack 42, win 229, options [nop,nop,TS val 1132505 ecr 2019293891], length 0
18:23:06.458760 IP 221.181.185.135.45155 > 138.197.150.27.ssh: Flags [P.], seq 16:872, ack 42, win 229, options [nop,nop,TS val 1132655 ecr 2019293891], length 856
18:23:07.370774 IP 221.181.185.135.45155 > 138.197.150.27.ssh: Flags [P.], seq 1:872, ack 42, win 229, options [nop,nop,TS val 1132883 ecr 2019293891], length 871
18:23:07.370834 IP 138.197.150.27.ssh > 221.181.185.135.45155: Flags [.], ack 872, win 504, options [nop,nop,TS val 2019295701 ecr 1132883], length 0
18:23:07.372036 IP 138.197.150.27.ssh > 221.181.185.135.45155: Flags [P.], seq 42:1098, ack 872, win 504, options [nop,nop,TS val 2019295702 ecr 1132883], length 1056
18:23:07.673498 IP 221.181.185.135.45155 > 138.197.150.27.ssh: Flags [.], ack 1098, win 245, options [nop,nop,TS val 1132958 ecr 2019295702], length 0
18:23:07.675226 IP 221.181.185.135.45155 > 138.197.150.27.ssh: Flags [P.], seq 872:952, ack 1098, win 245, options [nop,nop,TS val 1132959 ecr 2019295702], length 80
18:23:07.675264 IP 138.197.150.27.ssh > 221.181.185.135.45155: Flags [.], ack 952, win 504, options [nop,nop,TS val 2019296005 ecr 1132959], length 0
18:23:07.676475 IP 138.197.150.27.ssh > 221.181.185.135.45155: Flags [P.], seq 1098:1410, ack 952, win 504, options [nop,nop,TS val 2019296006 ecr 1132959], length 312
18:23:07.981660 IP 221.181.185.135.45155 > 138.197.150.27.ssh: Flags [P.], seq 952:968, ack 1410, win 262, options [nop,nop,TS val 1133035 ecr 2019296006], length 16
18:23:07.981716 IP 138.197.150.27.ssh > 221.181.185.135.45155: Flags [.], ack 968, win 504, options [nop,nop,TS val 2019296311 ecr 1133035], length 0
18:23:08.283039 IP 221.181.185.135.45155 > 138.197.150.27.ssh: Flags [P.], seq 968:1032, ack 1410, win 262, options [nop,nop,TS val 1133111 ecr 2019296311], length 64
18:23:08.283094 IP 138.197.150.27.ssh > 221.181.185.135.45155: Flags [.], ack 1032, win 504, options [nop,nop,TS val 2019296613 ecr 1133111], length 0
18:23:08.283230 IP 138.197.150.27.ssh > 221.181.185.135.45155: Flags [P.], seq 1410:1474, ack 1032, win 504, options [nop,nop,TS val 2019296613 ecr 1133111], length 64
18:23:08.586911 IP 221.181.185.135.45155 > 138.197.150.27.ssh: Flags [P.], seq 1032:1112, ack 1474, win 262, options [nop,nop,TS val 1133187 ecr 2019296613], length 80
18:23:08.593886 IP 138.197.150.27.ssh > 221.181.185.135.45155: Flags [P.], seq 1474:1554, ack 1112, win 504, options [nop,nop,TS val 2019296924 ecr 1133187], length 80
18:23:08.895398 IP 221.181.185.135.45155 > 138.197.150.27.ssh: Flags [P.], seq 1112:1208, ack 1554, win 262, options [nop,nop,TS val 1133264 ecr 2019296924], length 96
18:23:08.938597 IP 138.197.150.27.ssh > 221.181.185.135.45155: Flags [.], ack 1208, win 504, options [nop,nop,TS val 2019297268 ecr 1133264], length 0
18:23:08.953310 IP 138.197.150.27.ssh > 101.32.183.189.58556: Flags [P.], seq 1430:1498, ack 662, win 501, length 68
18:23:09.153524 IP 101.32.183.189.58556 > 138.197.150.27.ssh: Flags [P.], seq 662:714, ack 1498, win 262, length 52
18:23:09.153588 IP 138.197.150.27.ssh > 101.32.183.189.58556: Flags [.], ack 714, win 501, length 0
18:23:09.153626 IP 101.32.183.189.58556 > 138.197.150.27.ssh: Flags [F.], seq 714, ack 1498, win 262, length 0
18:23:09.159655 IP 138.197.150.27.ssh > 101.32.183.189.58556: Flags [F.], seq 1498, ack 715, win 501, length 0
18:23:09.282444 IP 45.155.205.156.57271 > 138.197.150.27.26072: Flags [S], seq 3175525048, win 1024, length 0
18:23:09.359773 IP 101.32.183.189.58556 > 138.197.150.27.ssh: Flags [.], ack 1499, win 262, length 0
18:23:12.307913 IP 138.197.150.27.ssh > 221.181.185.135.45155: Flags [P.], seq 1554:1634, ack 1208, win 504, options [nop,nop,TS val 2019300638 ecr 1133264], length 80
18:23:12.609433 IP 221.181.185.135.45155 > 138.197.150.27.ssh: Flags [P.], seq 1208:1304, ack 1634, win 262, options [nop,nop,TS val 1134192 ecr 2019300638], length 96
18:23:12.609475 IP 138.197.150.27.ssh > 221.181.185.135.45155: Flags [.], ack 1304, win 504, options [nop,nop,TS val 2019300939 ecr 1134192], length 0